{
  "schema": "agent-memory-staging-migration-cohort-input-v1",
  "classification": "staging_external",
  "environment": "staging",
  "cohort_id": "internal-cohort-2026",
  "dataset_version": "representative-v1",
  "consent_version": "consent-v1",
  "importer_version": "ampb2-v2",
  "inventory_id": "staging-inventory",
  "inventory_receipt_sha256": "aaaaaaaaaaaaaaaaaaaaaaaaaaaaaaaaaaaaaaaaaaaaaaaaaaaaaaaaaaaaaaaa",
  "plan_id": "staging-plan",
  "plan_receipt_sha256": "bbbbbbbbbbbbbbbbbbbbbbbbbbbbbbbbbbbbbbbbbbbbbbbbbbbbbbbbbbbbbbbb",
  "change_id": "staging-change",
  "change_receipt_sha256": "cccccccccccccccccccccccccccccccccccccccccccccccccccccccccccccccc",
  "release_id": "staging-release",
  "release_receipt_sha256": "dddddddddddddddddddddddddddddddddddddddddddddddddddddddddddddddd",
  "cohort_decision_sha256": "eeeeeeeeeeeeeeeeeeeeeeeeeeeeeeeeeeeeeeeeeeeeeeeeeeeeeeeeeeeeeeee",
  "cohort_report_sha256": "ffffffffffffffffffffffffffffffffffffffffffffffffffffffffffffffff",
  "consent_approved_at": "2026-08-10T06:00:00Z",
  "started_at": "2026-08-10T12:00:00Z",
  "completed_at": "2026-08-10T16:00:00Z",
  "generated_at": "2026-08-10T17:00:00Z",
  "account_count": 3,
  "library_count": 4,
  "source_count": 12,
  "memory_count": 20,
  "note_count": 8,
  "expected_item_count": 40,
  "imported_item_count": 32,
  "merged_item_count": 5,
  "skipped_item_count": 3,
  "failed_item_count": 0,
  "unexplained_loss_count": 0,
  "duplicate_publication_count": 0,
  "formats": [
    {"format": "pdf", "source_count": 4},
    {"format": "epub", "source_count": 3},
    {"format": "markdown", "source_count": 3},
    {"format": "text", "source_count": 2}
  ],
  "size_buckets": [
    {"bucket": "small", "source_count": 5},
    {"bucket": "medium", "source_count": 4},
    {"bucket": "large", "source_count": 3}
  ],
  "ready": true,
  "checks": [
    {"id": "cohort_consent_authorized", "outcome": "passed", "evidence_sha256": "1111111111111111111111111111111111111111111111111111111111111111"},
    {"id": "cohort_representative", "outcome": "passed", "evidence_sha256": "2222222222222222222222222222222222222222222222222222222222222222"},
    {"id": "bundle_integrity_verified", "outcome": "passed", "evidence_sha256": "3333333333333333333333333333333333333333333333333333333333333333"},
    {"id": "import_completed", "outcome": "passed", "evidence_sha256": "4444444444444444444444444444444444444444444444444444444444444444"},
    {"id": "reconciliation_complete", "outcome": "passed", "evidence_sha256": "5555555555555555555555555555555555555555555555555555555555555555"},
    {"id": "no_unexplained_loss", "outcome": "passed", "evidence_sha256": "6666666666666666666666666666666666666666666666666666666666666666"},
    {"id": "no_duplicate_publication", "outcome": "passed", "evidence_sha256": "7777777777777777777777777777777777777777777777777777777777777777"},
    {"id": "failures_reviewed", "outcome": "passed", "evidence_sha256": "8888888888888888888888888888888888888888888888888888888888888888"},
    {"id": "product_qa_review_complete", "outcome": "passed", "evidence_sha256": "9999999999999999999999999999999999999999999999999999999999999999"}
  ]
}
